{
  "$schema": "https://json-schema.org/draft/2020-12/schema",
  "$id": "https://purposesource.org/spec/schemas/registry-index-meta.v1.json",
  "title": "Registry index meta — /registry/index/meta.json",
  "description": "The registry index's table of contents: the shard list, registry-wide counts, and the delist set the badge route uses as a belt-and-braces guard against a stale cached badge (FS10-032 — the edge keeps this document hot in KV as `registry-index-meta`). Every registered repository is listed and counted once, whether or not its admins have claimed it (ops decision D82 item 1): in `totals.registered`, or in `totals.suspended` while it is suspended. No count separates claimed from unclaimed (D82 item 3 and its dated note (c) of 2026-09-29). *(Amended 2026-09-30: it said \"Counts include `detected` repositories in `totals.detected` only; they are never listed (GH-014).\")*",
  "x-psn": {
    "specVersion": "1.3.0",
    "phase": "P-M2",
    "artifactPath": "/registry/index/meta.json",
    "authoritative": true,
    "producer": "index-build (P-M2: index-build-lite CI, VS-04)",
    "consumers": ["web registry browse", "edge badge route delist guard (FS10-032)"],
    "fsRefs": ["FS-00 §6.2", "FS-02 §7 (FS02-062)", "FS-10 §2 (FS10-010)", "FS-10 §5 (FS10-032)"],
    "vsRefs": ["VS-04", "VS-17", "VS-24"],
    "changelog": "CHANGELOG.md#registry-index-metav1json"
  },
  "type": "object",
  "additionalProperties": false,
  "required": ["schemaVersion", "generatedAt", "shards", "totals"],
  "properties": {
    "schemaVersion": { "const": 1 },
    "generatedAt": { "type": "string", "format": "date-time" },
    "source": { "enum": ["registry-v0", "sample", "fixture", "platform"], "description": "Which plane produced this artifact. `sample` and `fixture` declare a NON-PRODUCTION plane: every page that renders such an artifact is labelled sample, and a production deployment refuses to serve it (FS-10 §2 v0 note; the edge route answers `sandbox_artifact_on_prod`). `registry-v0` is the P-M2 production source of record — the curated registry repository the index is built from. `platform` is the P-M3 producer of record — the platform database, rendered by `jobs.index-build`. Optional, and its absence asserts nothing: an artifact whose body cannot carry the label borrows the plane's declaration from `/registry/index/meta.json`. The enum widens additively when the P-M3 producer takes a value of its own, and `platform` (2026-09-12) is that widening: `jobs.index-build` writes it in `PSN_ENV=prod` and writes `fixture` in every other environment, so a reader can still tell a production plane from a synthetic one by the label alone." },
    "shards": {
      "type": "array",
      "description": "Every shard document that exists, with its entry count. A browse client fetches only the shards it needs.",
      "items": {
        "type": "object",
        "additionalProperties": false,
        "required": ["shard", "url", "count"],
        "properties": {
          "shard": { "type": "string", "pattern": "^[a-z0-9]$" },
          "url": { "type": "string", "format": "uri" },
          "count": { "type": "integer", "minimum": 0 }
        }
      }
    },
    "exportUrl": { "type": "string", "format": "uri", "description": "The bulk export document (same shape as a shard, `shard: \"export\"`)." },
    "totals": {
      "type": "object",
      "additionalProperties": false,
      "required": ["listed"],
      "properties": {
        "listed": { "type": "integer", "minimum": 0, "description": "Repositories that appear in a shard: registered + suspended + quit + delisted. In a document published before ops decision D82: verified + suspended + quit + delisted." },
        "registered": { "type": "integer", "minimum": 0, "description": "The shard entries whose state is `registered`: every registered repository that is not suspended, whether or not its admins have claimed it (ops decision D82 item 1). A suspended repository is registered in D82 item 1's sense too and is counted in `suspended`, so the registered repositories of D82 item 1, `stats.v1`'s `projectsRegistered`, are `registered` + `suspended`. Added 2026-09-30; a document published before D82 carries `verified` instead, and a document never carries both (see `totals`)." },
        "verified": { "type": "integer", "minimum": 0, "deprecated": true, "description": "Deprecated: not published from ops decision D82 on. Before D82 it counted the repositories listed as `verified`; beside `listed` it would now tell a reader how many registered repositories nobody has claimed, and whether admins have claimed is their internal matter (D82 item 3, dated note (c) of 2026-09-29). `registered` takes its place. Kept so a document published before D82 stays valid (versioning policy 4)." },
        "suspended": { "type": "integer", "minimum": 0 },
        "quit": { "type": "integer", "minimum": 0 },
        "delisted": { "type": "integer", "minimum": 0 },
        "detected": { "type": "integer", "minimum": 0, "deprecated": true, "description": "Deprecated: not published from ops decision D82 on. Before D82 it counted detected-but-unclaimed repositories, which were counted here and listed nowhere (GH-014). A detected repository is now registered, listed and counted in `registered`, and no public artifact counts unclaimed repositories (D82 items 1 and 3, dated note (c) of 2026-09-29; D82 closes URS §21 OPEN-33). Kept so a document published before D82 stays valid (versioning policy 4)." }
      },
      "not": { "anyOf": [{ "required": ["registered", "verified"] }, { "required": ["registered", "detected"] }] },
      "$comment": "One vocabulary per document (ops decision D82 item 3 and its dated note (c) of 2026-09-29): totals carrying `registered` carry neither deprecated count, because either one beside it would tell a reader how many registered repositories their admins have claimed. `registered` is new in 1.3.0, so no document published before it is refused. Added 2026-09-30."
    },
    "delisted": {
      "type": "array",
      "description": "Node ids of every listed repository whose state is `suspended`, `quit` or `delisted`. The badge route serves the neutral form for any id in this set even if a cached badge artifact still says otherwise (FS10-032). All three states render neutral — a stale badge never keeps asserting registration (WEB-085) — so the guard has to cover all three; the member keeps its name, which is the state a reader recognises. *(Wording corrected 2026-09-08: it said `delisted` or `quit`, and a suspended repository would have kept a registered badge alive on a cache.)*",
      "uniqueItems": true,
      "items": { "$ref": "#/$defs/githubNodeId" }
    }
  },
  "$defs": {
    "githubNodeId": { "type": "string", "pattern": "^([A-Za-z0-9_-]{4,128}|MDEwOlJlcG9zaXRvcnk[A-Za-z0-9+/=]{1,96})$", "description": "A GitHub GraphQL node_id, in either of the two forms GitHub has issued: the opaque current form (a repository's is `R_`-prefixed) and the legacy base64 form, whose decoded value begins `010:Repository` and whose `=` padding the first alternative cannot express. Widened 2026-09-08 to admit the second: `registry-v0-record.v1` accepts both, so a record the curated registry accepts is publishable in this artifact. The primary key for repositories and people throughout this contract set (FS-00 §6.1)." }
  }
}
